{"schema_version":"1.0","event_id":"3f15a042-daa9-449d-bfa6-7f36e05fa0b1","idempotency_key":"retry-key-0001","device_id":"7a72f608-658f-401a-ac51-8103adac45ef","location_id":"installation-a","event_type":"CONTENT_STARTED","content_id":"support-general","content_version":"1","content_age_band":"GENERAL","selection_mode":"MANUAL_TEST","audience_mode":"UNKNOWN","animation_started_at":"2026-01-01T00:00:00Z","animation_expected_end_at":"2026-01-01T00:01:00Z","occurred_at":"2026-01-01T00:00:00Z"}
